rule_id,priority,condition,status,issue_type,recommendation,next_action
DQ001,1,missing_ph_or_ec,วัดซ้ำ,ข้อมูลไม่ครบ,ข้อมูล pH/EC ยังไม่ครบ กรุณาตรวจและบันทึกใหม่,วัดซ้ำ
EV001,10,recent_event_contains_fertilizer,วัดซ้ำ,ค่าหลังใส่ปุ๋ยอาจแกว่ง,เพิ่งใส่ปุ๋ย ค่า pH/EC อาจเปลี่ยนชั่วคราว ควรวัดซ้ำอีก 3–7 วัน,วัดซ้ำ
PH001,20,ph_soil_fw_lt_5_0,ส่งตรวจเพิ่ม,pH ต่ำ,ค่า pH ต่ำมาก ควรส่งตรวจดินมาตรฐานก่อนตัดสินใจใส่ปูน,ส่ง lab
PH002,30,ph_soil_fw_lt_5_5,เฝ้าระวัง,pH ต่ำ,ค่า pH ต่ำกว่าช่วงเป้าหมาย ควรวัดซ้ำอีก 7 วัน,วัดซ้ำ
PH003,40,ph_soil_fw_gt_7_2,เฝ้าระวัง,pH สูง,ค่า pH สูง ควรตรวจแหล่งน้ำและเฝ้าระวังการขาด Fe Zn Mn,ตรวจน้ำ
EC001,50,ec_water_gt_0_75,เฝ้าระวัง,EC น้ำสูง,ค่า EC ของน้ำสูง น้ำอาจเป็นแหล่งความเค็ม ควรวัดซ้ำและตรวจแหล่งน้ำ,ตรวจน้ำ
EC002,60,delta_ec_gt_0_50,เฝ้าระวัง,EC ดินสูง,เมื่อดินสัมผัสน้ำแล้ว EC เพิ่มมาก อาจมีเกลือหรือปุ๋ยตกค้าง,วัดซ้ำ
OK001,99,default,ปกติ,ปกติ,ค่า pH/EC อยู่ในช่วงใช้งานได้ ให้ติดตามต่อเนื่องตามรอบวัดของแปลงนี้,ไม่ต้องทำ
